<data xmlns:xsi="http://www.w3.org/2001/XMLSchema-instance" xsi:noNamespaceSchemaLocation="../schemas/weapon_classes.xsd">
    <weaponClass id="pistol" isRanged="true" isLoud="true" skill="handguns">
        <name>pistol</name>
        <range>CLOSE</range>
        <attackType>basic_ranged</attackType>
        <attackType>targeted_ranged</attackType>
    </weaponClass>
    <weaponClass id="smg" isRanged="true" isLoud="true" skill="handguns">
        <name>SMG</name>
        <range>CLOSE</range>
        <attackType>basic_ranged</attackType>
        <attackType>targeted_ranged</attackType>
        <attackType>autofire</attackType>
    </weaponClass>
    <weaponClass id="shotgun" isRanged="true" isLoud="true" skill="long_arms">
        <name>shotgun</name>
        <range>FAR</range>
        <attackType>basic_ranged</attackType>
        <attackType>targeted_ranged</attackType>
    </weaponClass>
    <weaponClass id="assault_rifle" isRanged="true" isLoud="true" skill="long_arms">
        <name>assault rifle</name>
        <range>FAR</range>
        <attackType>basic_ranged</attackType>
        <attackType>targeted_ranged</attackType>
        <attackType>autofire</attackType>
    </weaponClass>
    <weaponClass id="sniper_rifle" isRanged="true" isLoud="true" skill="long_arms">
        <name>sniper rifle</name>
        <range>DISTANT</range>
        <attackType>basic_ranged</attackType>
        <attackType>targeted_ranged</attackType>
    </weaponClass>
    <weaponClass id="knife" isRanged="false" isLoud="false" skill="melee">
        <name>knife</name>
        <range>NEAR</range>
        <attackType>basic_melee</attackType>
        <attackType>targeted_melee</attackType>
    </weaponClass>
    <weaponClass id="sword" isRanged="false" isLoud="false" skill="melee">
        <name>sword</name>
        <range>NEAR</range>
        <attackType>basic_melee</attackType>
        <attackType>targeted_melee</attackType>
    </weaponClass>
    <weaponClass id="club" isRanged="false" isLoud="false" skill="melee">
        <name>club</name>
        <range>NEAR</range>
        <attackType>basic_melee</attackType>
        <attackType>targeted_melee</attackType>
    </weaponClass>
    <weaponClass id="axe" isRanged="false" isLoud="false" skill="melee">
        <name>axe</name>
        <range>NEAR</range>
        <attackType>basic_melee</attackType>
        <attackType>targeted_melee</attackType>
    </weaponClass>
    <weaponClass id="grenade" isRanged="true" isLoud="true" skill="throwing">
        <name>grenade</name>
        <range>CLOSE</range>
        <attackType>grenade</attackType>
    </weaponClass>
</data>